{
  "name": "serializerMessageTestProcess",
  "messages": [
    {
      "messageName": "TestEvent",
      "topicName": "test.topic",
      "correlationProvider": "ch.admin.bit.jeap.processcontext.repository.template.json.stubs.TestCorrelationProvider"
    },
    {
      "messageName": "TestEvent2",
      "topicName": "test2.topic"
    },
    {
      "messageName": "TestEvent3",
      "topicName": "test3.topic",
      "messageExtractor": "ch.admin.bit.jeap.processcontext.repository.template.json.stubs.TestMessageExtractor",
      "payloadExtractor": "ch.admin.bit.jeap.processcontext.repository.template.json.stubs.TestPayloadExtractor",
      "triggersProcessInstantiation": true
    },
    {
      "messageName": "TestEvent4",
      "topicName": "test4.topic",
      "correlatedBy": {
        "processDataKey": "processDataKey",
        "messageDataKey": "someMessageDataKey"
      },
      "referenceExtractor": "ch.admin.bit.jeap.processcontext.repository.template.json.stubs.TestReferenceExtractor"
    }
  ],
  "tasks": [
    {
      "name": "single-legacy",
      "cardinality": "single"
    },
    {
      "name": "dynamic-legacy",
      "cardinality": "dynamic"
    },
    {
      "name": "defaults"
    },
    {
      "name": "single",
      "lifecycle": "static"
    },
    {
      "name": "single-explicit",
      "lifecycle": "static",
      "cardinality": "single-instance"
    },
    {
      "name": "dynamic",
      "lifecycle": "dynamic"
    },
    {
      "name": "dynamic-multi",
      "lifecycle": "dynamic",
      "cardinality": "multi-instance"
    },
    {
      "name": "observed",
      "lifecycle": "observed",
      "observes": {
        "message": "TestEvent"
      }
    },
    {
      "name": "observedWithCondition",
      "lifecycle": "observed",
      "observes": {
        "domainEvent": "TestEvent",
        "condition": "ch.admin.bit.jeap.processcontext.repository.template.json.TestTaskInstantiationCondition"
      }
    },
    {
      "name": "plannedByEventOrMessage",
      "lifecycle": "dynamic",
      "plannedBy": {
        "message": "TestEvent"
      },
      "taskData": [
        {
          "sourceMessage": "TestEvent",
          "messageDataKeys": ["foo", "bar"]
        }
      ]
    },
    {
      "name": "plannedByEventOrMessageWithCondition",
      "lifecycle": "dynamic",
      "plannedBy": {
        "message": "TestEvent",
        "condition": "ch.admin.bit.jeap.processcontext.repository.template.json.TestTaskInstantiationCondition"
      }
    },
    {
      "name": "completedByDomainEvent",
      "completedBy": {
        "message": "TestEvent"
      },
      "taskData": [
        {
          "sourceMessage": "TestEvent",
          "messageDataKeys": ["foo"]
        }
      ]
    }
  ],
  "processData": [
    {
      "key": "processDataKey",
      "source": {
        "message": "TestEvent4",
        "messageDataKey": "sourceDataKey"
      }
    }
  ],
  "relationSystemId": "ch.test.System",
  "relationPatterns": [
    {
      "subject": {
        "type": "some-type",
        "selector": {
          "processDataKey": "processDataKey",
          "role": "some-role"
        }
      },
      "object": {
        "type": "some-other-type",
        "selector": {
          "processDataKey": "processDataKey"
        }
      },
      "predicateType": "some relationship"
    }
  ],
  "completions": [
    {
      "completedBy": {
        "condition": "ch.admin.bit.jeap.processcontext.plugin.api.condition.AllTasksInFinalStateProcessCompletionCondition"
      }
    },
    {
      "completedBy": {
        "message": "TestEvent4",
        "conclusion": "cancelled",
        "name": "Cancelled because of TestEvent4"
      }
    }
  ],
  "snapshots": [
    {
      "createdOn" : {
        "completion": "any"
      }
    }
  ]
}
